{
  "category": "Economy",
  "candidateA": {
    "name": "Mark Carney",
    "summary": "Mark Carney's economic promises focus on strengthening Canada's trade relationships and reducing reliance on the U.S. He pledges to protect Canadian workers and industries through retaliatory tariffs and strategic investments, while also aiming to foster internal trade and eliminate federal barriers. Carney also proposes middle-class tax cuts and targeted support for sectors like the auto industry and infrastructure.\n"
  },
  "candidateB": {
    "name": "Pierre Poilievre",
    "summary": "Pierre Poilievre's economic promises center on tax cuts, including a 15% income tax reduction for average workers and eliminating certain business tax write-offs. He pledges to stimulate resource development by repealing anti-development laws, expediting project approvals, and building infrastructure like pipelines. Additionally, he aims to promote interprovincial trade and support workers affected by tariffs through income replacement and flexible employment insurance.\n"
  },
  "comparison": {
    "differences": [
      {
        "point": "Tax Cuts",
        "carney_stance": "Proposes tax cuts, specifically a middle-class tax cut.",
        "poilievre_stance": "Proposes broad tax cuts, including a 15% income tax cut for the average worker and cuts on investment.",
        "carney_citations": [
          "m1-BopYdEZw_1",
          "3N4FF8KiyE8_3",
          "p-EwfoLgCUU_1",
          "eMst2T55aQY_2",
          "uH03sDpPYUk_1"
        ],
        "poilievre_citations": [
          "9UB9g4FfgsM_1",
          "vfciigh4jQA_3",
          "unlcIjd91lg_1",
          "unlcIjd91lg_6",
          "xr0LZ3ZCWvk_1",
          "d4STA-m4qVU_1",
          "uF48vV_rZ-M_5",
          "LfXDSKe_T0o_4",
          "LfXDSKe_T0o_15",
          "4hjNfCK9t8I_1",
          "0TARO3T4dXs_6",
          "tQlCarI1s_w_3",
          "vCrM2DIUnCs_4",
          "Q-6WJv4Cy5E_2",
          "KdUQKeh27Q4_1",
          "4KvGpasXclY_1",
          "T6fgqrF7c7g_1"
        ]
      },
      {
        "point": "Interprovincial Trade Barriers",
        "carney_stance": "Commitment to eliminate barriers to trade and labor mobility within Canada.",
        "poilievre_stance": "Promotes free trade between provinces.",
        "carney_citations": [
          "NdkHwkN8eEk_8",
          "eMst2T55aQY_1",
          "uH03sDpPYUk_6",
          "uH03sDpPYUk_7",
          "27eJz91LAi4_10",
          "eMst2T55aQY_1",
          "p-EwfoLgCUU_7",
          "nOywu3XgHPc_2",
          "nOywu3XgHPc_4",
          "7c9wDIQBnNc_9",
          "7c9wDIQBnNc_10",
          "7c9wDIQBnNc_11"
        ],
        "poilievre_citations": [
          "0TARO3T4dXs_5",
          "T6fgqrF7c7g_6"
        ]
      },
      {
        "point": "Using tariffs to protect workers",
        "carney_stance": "Commitment to use every dollar generated by tariffs to protect workers.",
        "poilievre_stance": "Provide support to workers who lose their jobs due to tariffs",
        "carney_citations": [
          "uWai9uK5xB0_2",
          "27eJz91LAi4_13",
          "NdkHwkN8eEk_9",
          "3N4FF8KiyE8_2",
          "NmiApBVqctQ_1",
          "p-EwfoLgCUU_1",
          "eMst2T55aQY_3",
          "uH03sDpPYUk_8"
        ],
        "poilievre_citations": [
          "0TARO3T4dXs_2"
        ]
      },
      {
        "point": "Responding to US tariffs",
        "carney_stance": "Commitment to respond with tariffs if the U.S. imposes tariffs.",
        "poilievre_stance": "Impose counter-tariffs on products that can be manufactured in Canada",
        "carney_citations": [
          "LpXB_uY0R50_2",
          "TGefa_0C4IM_1",
          "uWai9uK5xB0_1",
          "NmiApBVqctQ_3"
        ],
        "poilievre_citations": [
          "0TARO3T4dXs_1"
        ]
      },
      {
        "point": "Supply Management",
        "carney_stance": "Protect supply management, commitment to never discuss supply management in trade negotiations.",
        "poilievre_stance": "Defend supply management for farmers.",
        "carney_citations": [
          "ploRXkGspys_2",
          "XlUpgfy8aXk_3"
        ],
        "poilievre_citations": [
          "tQlCarI1s_w_9"
        ]
      },
      {
        "point": "Eliminating Duplicative Regulations/Streamlining Project Approvals",
        "carney_stance": "Eliminate duplicative federal regulations and establish a one-window approval process for major projects.",
        "poilievre_stance": "Repeal Bill C69 and replace it with a law for faster permits.",
        "carney_citations": [
          "27eJz91LAi4_9",
          "3N4FF8KiyE8_7",
          "7c9wDIQBnNc_8",
          "7c9wDIQBnNc_11"
        ],
        "poilievre_citations": [
          "4hjNfCK9t8I_4",
          "0TARO3T4dXs_4",
          "Q-6WJv4Cy5E_3",
          "4lI0--7ES0o_6",
          "4lI0--7ES0o_7",
          "T6fgqrF7c7g_3",
          "o4wvYQ1VEug_3"
        ]
      },
      {
        "point": "Reducing reliance on the United States and building new trading relations",
        "carney_stance": "Commitment to reduce reliance on the United States and build new trading relations",
        "poilievre_stance": "Build a new national pipeline to bypass the American market and sell oil to Europe.",
        "carney_citations": [
          "TGefa_0C4IM_2",
          "NdkHwkN8eEk_2",
          "NdkHwkN8eEk_5"
        ],
        "poilievre_citations": [
          "T6fgqrF7c7g_5"
        ]
      }
    ],
    "similarities": [
      {
        "point": "Commitment to removing barriers to trade within Canada.",
        "carney_stance": "Commitment to expand efforts to end barriers hindering trade and labor mobility and eliminate federal barriers to interprovincial trade.",
        "poilievre_stance": "Promote free trade between provinces and break down trade barriers between provinces.",
        "carney_citations": [
          "NdkHwkN8eEk_8",
          "eMst2T55aQY_1",
          "uH03sDpPYUk_6",
          "nOywu3XgHPc_2",
          "nOywu3XgHPc_4",
          "7c9wDIQBnNc_6",
          "7c9wDIQBnNc_9",
          "7c9wDIQBnNc_10",
          "7c9wDIQBnNc_11"
        ],
        "poilievre_citations": [
          "0TARO3T4dXs_5",
          "T6fgqrF7c7g_6"
        ]
      },
      {
        "point": "Commitment to using tariff revenues to support workers.",
        "carney_stance": "Commitment to use every dollar from retaliatory tariffs to protect Canadian workers.",
        "poilievre_stance": "Provide support to workers who lose their jobs due to tariffs.",
        "carney_citations": [
          "uWai9uK5xB0_2",
          "27eJz91LAi4_13",
          "3N4FF8KiyE8_2",
          "NdkHwkN8eEk_9",
          "NmiApBVqctQ_1",
          "p-EwfoLgCUU_1",
          "eMst2T55aQY_3",
          "uH03sDpPYUk_8"
        ],
        "poilievre_citations": [
          "0TARO3T4dXs_2"
        ]
      },
      {
        "point": "Commitment to retaliatory tariffs.",
        "carney_stance": "Commitment to retaliate against U.S. tariffs with Canadian trade actions.",
        "poilievre_stance": "Impose counter-tariffs on products that can be manufactured in Canada",
        "carney_citations": [
          "LpXB_uY0R50_2",
          "TGefa_0C4IM_1",
          "uWai9uK5xB0_1",
          "NmiApBVqctQ_3"
        ],
        "poilievre_citations": [
          "0TARO3T4dXs_1"
        ]
      },
      {
        "point": "Tax Cuts",
        "carney_stance": "Propose tax cuts",
        "poilievre_stance": "Cut taxes",
        "carney_citations": [
          "m1-BopYdEZw_1",
          "3N4FF8KiyE8_3",
          "p-EwfoLgCUU_4",
          "eMst2T55aQY_2",
          "uH03sDpPYUk_1"
        ],
        "poilievre_citations": [
          "9UB9g4FfgsM_1",
          "vfciigh4jQA_3",
          "unlcIjd91lg_1",
          "unlcIjd91lg_6",
          "xr0LZ3ZCWvk_1",
          "d4STA-m4qVU_1",
          "uF48vV_rZ-M_5",
          "owQcPYAu4v8_3",
          "LfXDSKe_T0o_4",
          "LfXDSKe_T0o_15",
          "4hjNfCK9t8I_1",
          "0TARO3T4dXs_6",
          "tQlCarI1s_w_3",
          "vCrM2DIUnCs_4",
          "Q-6WJv4Cy5E_2",
          "KdUQKeh27Q4_1",
          "KdUQKeh27Q4_4",
          "4KvGpasXclY_1",
          "4lI0--7ES0o_1",
          "T6fgqrF7c7g_1"
        ]
      },
      {
        "point": "Protect Workers",
        "carney_stance": "Protect Canadian workers",
        "poilievre_stance": "Provide support to workers",
        "carney_citations": [
          "27eJz91LAi4_12",
          "27eJz91LAi4_13",
          "27eJz91LAi4_15",
          "uWai9uK5xB0_2",
          "3N4FF8KiyE8_1",
          "3N4FF8KiyE8_2",
          "NdkHwkN8eEk_9",
          "NmiApBVqctQ_1",
          "p-EwfoLgCUU_1",
          "eMst2T55aQY_3",
          "uH03sDpPYUk_8"
        ],
        "poilievre_citations": [
          "0TARO3T4dXs_2"
        ]
      },
      {
        "point": "Streamline project approvals",
        "carney_stance": "Establish a one-window approval process for major projects and eliminate duplicative federal regulations.",
        "poilievre_stance": "Repeal C69 and replace it with a law for faster permits and Grant permits for mining within 6 months",
        "carney_citations": [
          "3N4FF8KiyE8_7",
          "27eJz91LAi4_9",
          "7c9wDIQBnNc_8",
          "7c9wDIQBnNc_11"
        ],
        "poilievre_citations": [
          "4hjNfCK9t8I_4",
          "Q-6WJv4Cy5E_4"
        ]
      },
      {
        "point": "Build Infrastructure",
        "carney_stance": "Unlocking major infrastructure projects",
        "poilievre_stance": "Build pipelines",
        "carney_citations": [
          "27eJz91LAi4_7",
          "3N4FF8KiyE8_6",
          "nOywu3XgHPc_3",
          "7c9wDIQBnNc_7",
          "uH03sDpPYUk_9",
          "XlUpgfy8aXk_1"
        ],
        "poilievre_citations": [
          "owQcPYAu4v8_2",
          "4lI0--7ES0o_7",
          "0TARO3T4dXs_4",
          "T6fgqrF7c7g_5"
        ]
      }
    ]
  }
}